text,helpfulness
"AQUISIÇÃO EM CARATER EMERGENCIAL, DE EQUIPAMENTOS DE PROTEÇÃO INDIVIDUAL - EPI PARA OS PROFISSIONAIS DAS UNIDADES PUBLICAS DE ATENDIMENTO DO SUAS E GESTORES, SUPERVISORES E VISITADORES DO PROGRAMA CRIANÇA FELIZ/ PRIMEIRA INFANCIA NO SUAS DURANTE A PANDEMIA DA COVID-19. Publicação original em 18/06, pg. 213.",13.0
CONTRATAÇÃO DE EMPRESA PARA CONFECÇÃO ARTESANAL DE EPl'S PARA OS PROFISSIONAIS DA SAÚDE NA PREVENÇÃO E COMBATE AO COVID • 19 NO MUNICÍPIO DE JAICÓS • PI.,13.0
Aquisição de medicamentos,13.0
"CONTRATO PARAO FORNECIMENTO DE EPl'S (AVENTAIS, MACACÕES IMPERMEÁVEIS E UNIFORMES) DESTINADOS AOS PROFISSIONAIS 00 HOSPITAL MUNICIPAL DONA LOURDES MOTA DE PIO IX (PI) QUE ESTÃO ATUANDO NO ENFRENTAMENTO A COVI0-19.",13.0
"CO TRATAÇÃO DE PESSOAS FÍSICAS E JURÍDICAS, RESIDENTES OU ESTABELECIDAS NO MUNICÍPIO DE REGENERAÇÃO, PARA O FORNECIMENTO EMERGENCIAL DE MÁSCARAS ARTESANAIS DE TECIDO, REUTILIZÁ VEIS, DESTINADAS A PESSOAS DE VULNERABILIDADE SOCIAL E ECO ÔMICA, BEM COMO AOS SERVIDORES PÚBLICOS DAS ÁREAS ADMINISTRATIVAS DOS ÓRGÃOS, A FIM DE PREVENIR OS RISCOS DE TRANSMISSÃO DO NOVO CORO A VÍRUS CAUSADOR DA COVID-19.",13.0
"CO TRATAÇÃO DE PESSOAS FÍSICAS E JURÍDICAS, RESIDENTES OU ESTABELECIDAS NO MUNICÍPIO DE REGENERAÇÃO, PARA O FORNECIMENTO EMERGENCIAL DE MÁSCARAS ARTESANAIS DE TECIDO, REUTILIZÁ VEIS, DESTINADAS A PESSOAS DE VULNERABILIDADE SOCIAL E ECO ÔMICA, BEM COMO AOS SERVIDORES PÚBLICOS DAS ÁREAS ADMINISTRATIVAS DOS ÓRGÃOS, A FIM DE PREVENIR OS RISCOS DE TRANSMISSÃO DO NOVO CORO A VÍRUS CAUSADOR DA COVID-19.",13.0
"Confecçao de Mascara em tecido e Kit de Avental, Touca e Marcara em TNT gramal\Jra para o Município de Geminiano-Pl.",13.0
"Aquisição de Equipamentos de Proteção Individual destinado à Secretaria Municipal de, Assistência Social no período de enfrentamento do Covid-19 em Vila Nova do Piauí.",13.0
"CO TRATAÇÃO DE PESSOAS FÍSICAS E JURÍDICAS, RESIDENTES OU ESTABELECIDAS NO MUNICÍPIO DE REGENERAÇÃO, PARA O FORNECIMENTO EMERGENCIAL DE MÁSCARAS ARTESANAIS DE TECIDO, REUTILIZÁ VEIS, DESTINADAS A PESSOAS DE VULNERABILIDADE SOCIAL E ECO ÔMICA, BEM COMO AOS SERVIDORES PÚBLICOS DAS ÁREAS ADMINISTRATIVAS DOS ÓRGÃOS, A FIM DE PREVENIR OS RISCOS DE TRANSMISSÃO DO NOVO CORO A VÍRUS CAUSADOR DA COVID-19.",13.0
"CO TRATAÇÃO DE PESSOAS FÍSICAS E JURÍDICAS, RESIDENTES OU ESTABELECIDAS NO MUNICÍPIO DE REGENERAÇÃO, PARA O FORNECIMENTO EMERGENCIAL DE MÁSCARAS ARTESANAIS DE TECIDO, REUTILIZÁ VEIS, DESTINADAS A PESSOAS DE VULNERABILIDADE SOCIAL E ECO ÔMICA, BEM COMO AOS SERVIDORES PÚBLICOS DAS ÁREAS ADMINISTRATIVAS DOS ÓRGÃOS, A FIM DE PREVENIR OS RISCOS DE TRANSMISSÃO DO NOVO CORO A VÍRUS CAUSADOR DA COVID-19.",13.0
"CO TRATAÇÃO DE PESSOAS FÍSICAS E JURÍDICAS, RESIDENTES OU ESTABELECIDAS NO MUNICÍPIO DE REGENERAÇÃO, PARA O FORNECIMENTO EMERGENCIAL DE MÁSCARAS ARTESANAIS DE TECIDO, REUTILIZÁ VEIS, DESTINADAS A PESSOAS DE VULNERABILIDADE SOCIAL E ECO ÔMICA, BEM COMO AOS SERVIDORES PÚBLICOS DAS ÁREAS ADMINISTRATIVAS DOS ÓRGÃOS, A FIM DE PREVENIR OS RISCOS DE TRANSMISSÃO DO NOVO CORO A VÍRUS CAUSADOR DA COVID-19.",13.0
"CO TRATAÇÃO DE PESSOAS FÍSICAS E JURÍDICAS, RESIDENTES OU ESTABELECIDAS NO MUNICÍPIO DE REGENERAÇÃO, PARA O FORNECIMENTO EMERGENCIAL DE MÁSCARAS ARTESANAIS DE TECIDO, REUTILIZÁ VEIS, DESTINADAS A PESSOAS DE VULNERABILIDADE SOCIAL E ECO ÔMICA, BEM COMO AOS SERVIDORES PÚBLICOS DAS ÁREAS ADMINISTRATIVAS DOS ÓRGÃOS, A FIM DE PREVENIR OS RISCOS DE TRANSMISSÃO DO NOVO CORO A VÍRUS CAUSADOR DA COVID-19.",13.0
"CO TRATAÇÃO DE PESSOAS FÍSICAS E JURÍDICAS, RESIDENTES OU ESTABELECIDAS NO MUNICÍPIO DE REGENERAÇÃO, PARA O FORNECIMENTO EMERGENCIAL DE MÁSCARAS ARTESANAIS DE TECIDO, REUTILIZÁ VEIS, DESTINADAS A PESSOAS DE VULNERABILIDADE SOCIAL E ECO ÔMICA, BEM COMO AOS SERVIDORES PÚBLICOS DAS ÁREAS ADMINISTRATIVAS DOS ÓRGÃOS, A FIM DE PREVENIR OS RISCOS DE TRANSMISSÃO DO NOVO CORO A VÍRUS CAUSADOR DA COVID-19.",13.0
"REFERENTE Á COMPRA DE MATERIAL PARA UTILIZAÇÃO PROTEÇÃO (MACACÃO LONGO DE MANGA LONGA E CAPUZ DESCARTÁVEL)
DE PESSOA PARA EVITAR A CONTAMINAÇÃO PELO COVID-19 (CORO AVfRUS) PARA A SECRETARIA MUNICIPAL DE SAÚDE A",13.0
Aquisição de medicamentos,13.0
"Aquisição de EPI'S de proteção individual para os profissionais de saúde no enfretamento do corona vírus (COVID-19), na forma estabelecida pela lei 13.979/2020",13.0
"AQUISIÇÃO DE MASCARA MALHA REUTILIZAVEL, MASCARA DESC
SEM VALV PI, PROTETOR FACIAL, OCULOS PROTECAO JAGUAR INC
KALIPSO, PULVERJZADOR SL, FlTA ZEBRADA, LAMP. ISW E FIO TORCIDO PARA SECRETARIA MUNICIPAL DE SAÚDE DO MUNICÍPIO OE SÃO JOSÉ DO PIAUI",13.0
AQUISIÇÃO DE ALCOOL GEL PARA ATENDIMENTO ÀS MEDIDAS DE ENFRENTAMENTO A PANDEMIA DO CORONAVIRUSCOVID- 19.,13.0
"CONTRATAÇÃO DE PESSOA JURÍDICA PARA O FORNECIMENTO DE TECIDOS PARA FABRICAÇÃO DE EPl'S (MASCARAS, COLETES, AVENTAIS, BALACLA VA, TOUCA CIRÚRGICA E OUTROS) PARA A PREVENÇÃO E COMBA TE AO COVID-19. PANDEMIA DE CORONAVIRUS NO MUNICIPIO DE BERTOLÍNIA.",13.0
"CONTRATAÇÃO DE PESSOA FISICA PARA O FORNECIMENTO DE SERVIÇOS DE CONFECÇÃO DE EPl'S DE TNT (MASCARAS DESCARTÁVEIS) PARA PREVENÇÃO E COMBATE AO COVID-19, PANDEMIA DE CORONAVIRUS NO MUNICIPIO DE BERTOLÍNIA",13.0
Aquisição de medicamentos,13.0
Aquisição de material hospitalar,13.0
"aquisição de medicamentos pera o trotamento do covid-19 e saco, paa óbito c/ zfper, de Interesse desta Secretario Municpol de Saúde do MunlcTplo de Coroo:.t>o< do Pioul. vi<lo que no momento e<lomo< em !lluoçõo de emergência de saúde públlca, em decO!Tãr>e:lo do infecçõo humono coU<Odo pelo novo c<Yono VIM - (COVID-19).",13.0
"Aquisição de EPI'S de proteção individual para os profissionais de saúde no enfretamento do corona vírus (COVID-19), na forma estabelecida pela lei 13.979/2020",13.0
Aquisição de medicamentos,13.0
AQUISIÇÃO DE MATERIAIS DE EPI PARA ATENDER ÁS NECESSIDADES DA SECRETARIA MUNICIPAL DE ASSISltNCIA SOCIAL DO Ml.tllCIPIO DE RIBEIRO GONÇALVES-PI.,13.0
"AQUISIÇÃO DE EQUIPAMENTOS DE PROTEÇÃO INDIVIDUAL - EPI'S, PARA ATENDER AS NECESSIDADES DA SECRETARIA MUNICIPAL DE SAÚDE EM CARÁTER EMERGENCIAL",13.0
"aquisição de EPI (élcool, avental, luvas, máscaras, protetor facial e toucas) para Secretaria de Assistência Social do Municlpio de Campo Grande do Piauí-PI",13.0
"Contratação de Empresa para fornecimento de Materiais Preventivos, para subsidiaR medidas de controle e prevenção do novo coronavlrus no munidpio de Porto Alegre do Piauí.",13.0
CONTRATAÇÃO DE EMPRESA PARA FORNECIMENTO DE ALCOOL SPRAY 70 PARA SEREM UTILIZADOS PELOS PROFISISONAIS DO HOSPITAL REGIONAL DE CAMPO MAIOR NA PREVENÇÃO E COMBATE AO NOVO CORONAVIRUS (COVID-19),13.0
"AQUISIÇÃO DE MÁSCARAS DE TECIDO, NECESSÁRIAS AS AÇÕES DA
SECRETARIA MUNICIPAL DE SAÚDE DO MUNICIPIO DE SANTANA DO PIAUI (PI), PARA O ENFRENTAMENTO AO COVID- 19 DURANTE O PER10DO DA PANDEMIA",13.0
Contratação de empresa para fornecimento de Álcool Gel 70% 92g. para subsidiar medidas de controle e prevenção do novo coronavlrus no municlpio de Pono Alegre do Piaui,13.0
"fornecimento de bens e Insumos de saúde destinados ao enfrentamento daernergênclade saúde pública de importAncia internacional decorrente do roronavl ru s, para alender as neo866idedes do Municipio de Tamboril do Piaul.PI. ( EPI)",13.0
"Aquisição de EQUIPAMENTOS DE PROTEÇÃO INDIVIDUAL - llPI, destinados a utilização das equipes de Trabalho para enfrentamento da COVID-19, e também MASCARAS DESCARTÁVEIS para distribuição a pessoas de baixa renda neste municlpio de Dirceu Arcoverde - PI",13.0
"Contratação de empresa para fornecimento de Álcool Gel 70% 5000ml, para subsidiar medidas de controle e prevenção do novo coronavims no município de Porto Alegre do Piauí.",13.0
"AQUISIÇÃO DE EQUIPAMENTOS DE PROTEÇÃO INDMDUAL(EPI'S), PRODUTOS DE LIMPEZA, TERMÔMETROS DIGITAIS INFRAVERMELHO PARAOS PROFISSIONAIS QUE ESTÃO À FRENTE DAS AÇÕES DE COMBATE E ENFRENTAMENTO AO CORONAVIRUS E TESTES RÁPIDOS PARA SEREM
UTILIZADOS NA TRIAGEM DOS PACIENTES QUE APRESENTAREM SINTOMAS COM QUADRO CLINICO SUGESTIVO AO COVID-19",13.0
"AQUISIÇÃO DE EQUIPAMENTOS DE PROTEÇÃO INDMDUAL{EPI'S), PRODUTOS DE LIMPEZA, TERMÔMETROS DIGITAIS IN·FRA VERMELHO PARA OS PROFISSIONAIS QUE ESTÃO À FRENTE DAS AÇÕES DE COMBATE E ENFRENTAMENTO AO CORONAV1RUS E TESTES RÁPIDOS PARA SEREM UTILIZADOS NA TRIAGEM DOS PACIENTES QUE APRESENTAREM SINTOMAS COM QUADRO CLINICO SUGESTNO AO COVID-19,",13.0
"AQUISIÇÃO DE EQUIPAMENTOS DE PROTEÇÃO INDMDUAL{EPI'S), PRODUTOS DE LIMPEZA, TERMÔMETROS DIGITAIS IN·FRA VERMELHO PARA OS PROFISSIONAIS QUE ESTÃO À FRENTE DAS AÇÕES DE COMBATE E ENFRENTAMENTO AO CORONAV1RUS E TESTES RÁPIDOS PARA SEREM UTILIZADOS NA TRIAGEM DOS PACIENTES QUE APRESENTAREM SINTOMAS COM QUADRO CLINICO SUGESTNO AO COVID-19,",13.0
Ato: AQUISIÇÃO MEDICAMENTO CLOROQUINA 450 mg (120 CAPSULAS).,13.0
Aquisições de Álcool Gel e Etílico - Ação Combate: COVID-19,13.0
"CONTRATAÇÃO DE PESSOA JURÍDICA PARA O FORNECIMENTO DE MACACÕES DESCARTÁVEIS EM TNT PARA OS AGENTES DE COMBATE AO COVID-19, PANDEMIA DE CORONAVIRUS NO MUNICIPIO DE BERTOLÍNIA",13.0
"AQUISIÇÃO DE MASCARAS PARA ATENDIMENTO AS
MEDIDAS DE ENFRENTAMENTO A PANDEMIA DO CORONAVIRUS·
COVID-19.",13.0
Aquisição de máscaras/reutilizável/semi facial filtrante.,13.0
"CONTRATAÇÃO DE PESSOA FISICA PARA O FORNECIMENTO DE SERVIÇOS DE CONFECÇÃO DE EPl'S DE TNT (MASCARAS DESCARTÁVEIS) PARA PREVENÇÃO E COMBATE AO COVID-19, PANDEMIA DE CORONAVIRUS NO MUNICIPIO DE BERTOLÍNIA",13.0
AQUISIÇÃO DE MASCARAS COM VISEIRA,13.0
Aquisição viseiras (CX C/ 50 unidades,13.0
Aquisição de Medicamentos,13.0
"Contratação de Empresa para aquisição de Equipamentos de
proteção individual para o Combate a Pandemia COVID-19 do Município de Socorro do Piauí-PI",13.0
"CONTRATAÇÃO DE PESSOA FISICA PARA O FORNECIMENTO DE SERVIÇOS DE CONFECÇÃO DE EPl'S (GORROS DE TECIDO E TNTI PARA AÇÃO DE COMBATE AO COVID- 19, PANDEMIA DE CORONAVIRUS NO MUNICIPIO DE BERTOLÍNIA,",13.0
"Aquisicdo do medicamento ivermectina 6mg (caixa com 4 unidades), para atender as necessidades do Hospital de Campanha Nossa Senhora de Fatima, frente ao combate a pandemia do COVID-19, no Municipio de Parnaiba-PI, conforme detalhamento constante na Solicitacao de Materiais / Servicos n° 459/20 do Processo n° 13780/2020.",13.0
"Aquisição de 33.570 (trinta e três mil e quinhentos e setenta) cápsulas PANCREATINA 25.000 UI CAP GRUPO B, para a DIRETORIA DE UNIDADE DAASSISTENCIA FARMACEUTICA - DUAF",13.0
"CONTRATAÇÃO DE PESSOA FISICA PARA O FORNECIMENTO DE SERVIÇOS DE CONFECÇÃO DE EPl 'S (SOBRE BOTAS DE TECIDO E TNT) PARA AÇÃO DE COMBATE AO COVID-19, PANDEMIA DE CORONAVIRUS NO MUNICIPIO DE BERTOLÍNIA",13.0
Aquisição de Medicamentos,13.0
"CONTRATAÇÃO DE PESSOA FISICA PARA O FORNECIMENTO DE SERVIÇOS DE CONFECÇÃO DE EPl 'S (SOBRE BOTAS DE TECIDO E TNT) PARA AÇÃO DE COMBATE AO COVID-19, PANDEMIA DE CORONAVIRUS NO MUNICIPIO DE BERTOLÍNIA",13.0
"Contratação de empresa para aquisição de protetores faciais (Face Shields) para atender as necessidades da Defensoria Pública do Estado do Piauí, para enfrentamento da emergência de saúde pública decorrente do coronavírus (COVID-19) responsável pela pandemia",13.0
Contratação de empresa para fornecimento de material de proteção /higiênico em caráter de urgência destinados ao enfrentamento da emergência de saúde pública decorrente do novo coronavirus (covid-19) e,13.0
"presente contrato tem por objeto a aquisicao de medicamentos em carater emergencial para auxiliar no combate contra a pandemia COVID — 19 em ambiente hospitalar no hospital de campanha no municipio de Parnaiba - PI,",13.0
"CONTRATAÇÃO DE EMPRESA PARA CONFECÇÃO ARTESANAL DE EPl'S
PARA OS PROFISSIONAIS DA SAÚDE NA PREVENÇÃO E COMBATE AO COVID-19 NO MUNICÍPIO DE PATOS DO PIAUI - PI.",13.0
"CONTRATAÇÃO DE EMPRESA PARA FONECIMENTO DE EPl'S PARA OS
PROFISSIONAIS DA SAÚDE NA PREVENÇÃO E COMBATE AO COVID-19 NO MUNICÍPIO DE PATOS DO PIAUI - PI.",13.0
"CONTRATAÇÃO DE PESSOA FISICA PARA O FORNECIMENTO DE SERVIÇOS DE CONFECÇÃO DE EPl 'S (SOBRE BOTAS DE TECIDO E TNT) PARA AÇÃO DE COMBATE AO COVID-19, PANDEMIA DE CORONAVIRUS NO MUNICIPIO DE BERTOLÍNIA",13.0
"CONTRATAÇÃO DE PESSOA FISICA PARA O FORNECIMENTO DE SERVIÇOS DE CONFECÇÃO DE EPl 'S (SOBRE BOTAS DE TECIDO E TNT) PARA AÇÃO DE COMBATE AO COVID-19, PANDEMIA DE CORONAVIRUS NO MUNICIPIO DE BERTOLÍNIA",13.0
"Contratação de empresa, para a aquisição de EPl's e álcool gel, para atender as necessidades da Secretaria de Assistência Social da Prefeitura Municipal de Caxingó-PI",13.0
conlratação de empresa para fornecimento de (EPls) equipamento de proteção individual. Para atender as demandas da secretaria de saúde no enfrentamento a pandemia Covíd-19 no município de Cocal-PI.,13.0
"SUPRESSÃO DOS ITENS 13, 19, 21, 45, 102, 110 E 149 DO CONTRATO Nº 85/2020/FEPIERH, CUJO OBJETO É AQUISIÇÃO DE MEDICAMENTOS PARA ATENDER A DEMANDA EMERGENCIAL DO HOSPITAL GETÚLIO VARGAS - HGV",13.0
"Aquisição de 1600 ampolas de Fenitoina Sódica de 50 MG/ML injetável AMP 5 ML, para atende as necessidades do Hospital Municipal Dirceu Meneie Arcoverde do Município de Água Branca/PI",13.0
Aquisição de materiais de EPI.,13.0
"CONTRATAÇÃO DE PESSOA FISICA PARA O FORNECIMENTO DE SERVIÇOS DE CONFECÇÃO DE EPl 'S (SOBRE BOTAS DE TECIDO E TNT) PARA AÇÃO DE COMBATE AO COVID-19, PANDEMIA DE CORONAVIRUS NO MUNICIPIO DE BERTOLÍNIA",13.0
"Aquisicgéo em cardter emergencial de medicamentos para o
Hospital de Campanha Nossa Senhora de Fatima com finalidade no tratamento de pacientes infectados pelo COVID-19, no municipio de Parnaiba - PI,",13.0
"Aq~içõo de EPl ""S - (equipamenlo, de proteção individuo!), matenal de linpeza pero a prevenção e conlrole da covid-19, objetivando ofender cs necessidades deste Secrelcno Municipal de Saúde do município de Coraúbos do Piauí, visto que no momento estamos em síruaçõo de emergência de saúde pública, em decorrência da Infecção humano pelo novo coronavlrus - COVID-19.
ERRATA DE VALOR NO DIARIO DO DIA 24/07/2020 PAGINA 140",13.0
"CONTRATAÇÃO DE PESSOA JURÍDICA PARA O FORNECIMENTO DE DE EPl'S (BOTAS IMPERMEÁVEIS) PARA COMBATE AO COVID-19, PANDEMIA DE CORONAVIRUS NO MUNICIPIO DE BERTOLÍNIA,",13.0
"Aquisigaéo de Medicamentos para o Hospital de Campanha Nossa Senhora de Fatima, com a finalidade de atender os pacientes infectados com o COVID-19, no Municipio de Parnaiba - PI, de interesse da Secretaria Municipal de Satide;",13.0
"Aquisig¢do de medicamentos para o Hospital Nossa Senhora de Fatima com finalidade no tratamento de pacientes infectados pelo COVID-19, no municipio de Parnaiba - PI,",13.0
"Aquisicao de Medicamentos para o Hospital de Campanha N. Sra. de Fatima, com a finalidade de atender os pacientes infectados com o COVID-19, no Municipio de Parnaiba - PI, de interesse da Secretaria
Municipal de Satide;",13.0
"CONTRATAÇÃO DE EMPRESA PARA O FORNECIMENTO DE MEDICAMENTOS E MATERIAIS HOSPITALARES, RELACIONADOS AO COMBATE/PREVENÇÃO DO COVID-19, QUE ATENDA AS NECESSIDADES DA SECRETARIA MUNICIPAL DE SAÚDE NO MUNICIPIO DE CARIDADE DO PIAUI/Pi",13.0
"AQUISIÇÃO DE EQUIPAMENTOS DE PROTEÇÃO INDMDUAL{EPI'S), PRODUTOS DE LIMPEZA, TERMÔMETROS DIGITAIS INFRAVERMELHO PARA OS PROFISSIONAJS QUE ESTÃO Â FRENTE DAS AÇOES DE COMBATE EENFRENTAMENTO AO CORONAv!RUS E TESTES RÁPIDOS PARA SEREM UTILIZADOS NA TRIAGEM DOS PACIENTES QUE APRESENTAREM SINTOMAS COM QUADRO CLÍNICO SUGESTIVO AO COVJD-19, EM CARÁTER DE URGÊNCIA E EMERGÊNCIA, DIANTE DA EXISTÊNCIA DE PANDEMIA DO COVJD-19 (NOVO CORONAVIRUS),",13.0
"AQUISIÇÃO DE EQUIPAMENTOS DE PROTEÇÃO INDMDUAL{EPI'S), PRODUTOS DE LIMPEZA, TERMÔMETROS DIGITAIS INFRAVERMELHO PARA OS PROFISSIONAJS QUE ESTÃO Â FRENTE DAS AÇOES DE COMBATE EENFRENTAMENTO AO CORONAv!RUS E TESTES RÁPIDOS PARA SEREM UTILIZADOS NA TRIAGEM DOS PACIENTES QUE APRESENTAREM SINTOMAS COM QUADRO CLÍNICO SUGESTIVO AO COVJD-19, EM CARÁTER DE URGÊNCIA E EMERGÊNCIA, DIANTE DA EXISTÊNCIA DE PANDEMIA DO COVJD-19 (NOVO CORONAVIRUS),",13.0
"AQUISIÇÃO DE EQUIPAMENTOS DE PROTEÇÃO INDMDUAL{EPI'S), PRODUTOS DE LIMPEZA, TERMÔMETROS DIGITAIS INFRAVERMELHO PARA OS PROFISSIONAJS QUE ESTÃO Â FRENTE DAS AÇOES DE COMBATE EENFRENTAMENTO AO CORONAv!RUS E TESTES RÁPIDOS PARA SEREM UTILIZADOS NA TRIAGEM DOS PACIENTES QUE APRESENTAREM SINTOMAS COM QUADRO CLÍNICO SUGESTIVO AO COVJD-19, EM CARÁTER DE URGÊNCIA E EMERGÊNCIA, DIANTE DA EXISTÊNCIA DE PANDEMIA DO COVJD-19 (NOVO CORONAVIRUS),",13.0
"AQUISIÇÃO DE EPl's, PARA ATENDER AS NECESSIDADES DA SECRETARIA MUNICIPAL DE ASSISTÊNCIA SOCIAL DE OEIRAS/PI, PARA ENFRENTAMENTO DA EMERGÊNCIA DE SAÚDE PÚBLICA DECORRENTE DO CORONAVIRUS (COVID-19) NO MUNICIPIO DE OEIRAS-PI.",13.0
AQUISIÇÃO DE MASCARAS REUTILIZAVEIS.,13.0
CO TRATAÇÁO DE EMPRESA ESPECIALJZADA EM SERVIÇO DE CONFECÇÃO DE AVE TAIS DESCARTAVEIS EM TECIDO TNT PARA ENFRENTAMENTO AO COVID-19.,13.0
aquisição de aventais e macacões em TNT para o enfrentamento do covld-19 no Município de Paulistana-PI.,13.0
Aquisição de materiais e equipamentos de proteção individual • EPls. Para enfrentamento da Pandemia COVID-19. através da Secretaria Municipal de Saúde CARACOL - PI .,13.0
FORNECIMENTO DE ÁLCOL EM GEL DESTINADO AO ENFRENTAMENTO DA PANDEMIA DA COVID-19 NO ÂMBITO DO MUNICÍPIO NAZÁRIA-Pl,13.0
"CONTRATO DE AQUISIÇÃO DE EPl's, PARA ATENDER AS NECESSIDADES DA SECRETARIA MUNICIPAL DE SAÚDE DE OEIRAS/PI, PARA ENFRENTAMENTO DA EMERGÊNCIA DE SAÚDE PÚBLICA DECORRENTE DO CORONAVÍRUS (COVID-19) NO MUNICÍPIO DE OEIRAS-PI",13.0
"Aquisicdo de azitromicina 500mg, para atender as necessidades do Hospital de Campanha Nossa Senhora de Fatima, frente ao combate a pandemia do COVID-19, no Municipio de Parnaiba-pi, conforme detalhamento constante na Solicitagaéo de Materiais / Servicos n° 461/20 do Processo n° 13815/2020;",13.0
"AQUISIÇÃO DE MASCARA FACIAL FILTRANTE/ Ação Combate: COVID-19

VALOR UNITÁRIO DE 13,00 MAXIMO DE 2.000 UNIDADES",13.0
"contratação de empresa especializada no fornecimento de
termômetro, óculos de proteção, proteior facial e ouiros EPls,
dest inados às equipes de enfrentamento do Covid-1 9, no
municioio de Esoerantina-Pl.",13.0
"contratação de empresa especializada no fornecimento de
termômetro, óculos de proteção, proteior facial e ouiros EPls,
dest inados às equipes de enfrentamento do Covid-1 9, no
municioio de Esoerantina-Pl.",13.0
"contratação de empresa especializada no fornecimento de
termômetro, óculos de proteção, proteior facial e ouiros EPls,
dest inados às equipes de enfrentamento do Covid-1 9, no
municioio de Esoerantina-Pl.",13.0
"contratação de empresa especializada no fornecimento de
termômetro, óculos de proteção, proteior facial e ouiros EPls,
dest inados às equipes de enfrentamento do Covid-1 9, no
municioio de Esoerantina-Pl.",13.0
Contratação de empresa em caráter emergencial de fornecedor para aquisição de material hospitalar (EPI's) destinado ao enfrentamento da pandemia da covid-19 no âmbito do Município De Altos - PI.,13.0
Contratação de empresa em caráter emergencial de fornecedor para aquisição de material hospitalar (EPI's) destinado ao enfrentamento da pandemia da covid-19 no âmbito do Município De Altos - PI.,13.0
"Aquisição de álcool aerosol 70 inpm para atender as necessidades do HRJBM, ao qual se destina, em conformidade com as epsecificações e condições deste Termo de Referência, como forma de medidas de enfrentamento ao novo coronavírus",13.0
"AQUISIÇÃO D E EQUIPAMENTOS D E PROTECAO I N DIVIDUAL-EPl 'S E CORRELATOS PARA A SECRETARIA MUNICIPAL DE ASSISTENCIA SOCIAL, DESTINADOS AO ENFRENTAMENTO DA EMERGJ;;NCIA DE SAÚDE PÚBLICA DECORRENTE DO NOVO CORONAVIRUS (COVID-19) NO MUNICIPIO DE !TAi ÔPOLl S-Pl",13.0
"AQUISIÇÃO DE EQUIPAMENI'OS DE PROTEÇÃO INDUVIDUAL (EPI'S), NECESSARIOS AS AÇÕES DA SECRETARIA MUNICIPAL DE DESENVOLVlMENI'O SOCIAL DO MUNIClPIO DE SANTANA DO PIAul - PI, PARA O ENFRENTAMENI'O AO COVID-19 DURANTE O PERlODO DA PANDEMIA"".",13.0
"contratação de empresa especializada no fornecimento de
termômetro, óculos de proteção, proteior facial e ouiros EPls,
dest inados às equipes de enfrentamento do Covid-1 9, no
municioio de Esoerantina-Pl.",13.0
AQUISIÇÃO DE EQUIPAMENTOS DE PROTEÇÃO INDIVID UAL PARA AT!!:NOER A SECRETARIA DE ASSISTf:NCIA SOCIAL DO MUNICÍPIO DE DOMINGOS MOURÃO -PI NO COMBATE AO COVID- 19,13.0
"aquisição de EPI (avental, macacão e Propé) em TNT para o enfrentamento do covid-19 no Município de Santo Antonio de Lisboa-PI.",13.0
Aquisição de equipamentos de proteção individual - macações ,13.0
AQUISIÇÃO DE MATERIAIS DE EPI PARA ATENDER ÀS NECESSIDADES DA SECRETARIA MUNICIPAL DE SAÚDE DO MUNICÍPIO DE RIBEIRO GONÇALVES-PI.,13.0
PRORROGAÇÃO FORNECIMENTO DE MEDICAMENTOS DIVERSOS E MATERIAL HOSPITALLAR PARA O HOSPITAL ESTADUAL DOMINGOS CHAVES,13.0
"contratação de empresa especializada no fornecimento de
termômetro, óculos de proteção, proteior facial e ouiros EPls,
dest inados às equipes de enfrentamento do Covid-1 9, no
municioio de Esoerantina-Pl.",13.0
"contratação de empresa especializada no fornecimento de
termômetro, óculos de proteção, proteior facial e ouiros EPls,
dest inados às equipes de enfrentamento do Covid-1 9, no
municioio de Esoerantina-Pl.",13.0
"Aventais -Toucas - Propés - GD-01 e outros. Publicação original em 19/06, pg. 276.",13.0
Aquisição de EQUIPAMENTOS DE PROTEÇÃO INDIVIDUAL destinados a utilização pelas equipes de trabalho da Secretaria de Saúde e Hospital de Pequeno Porte no enfrentamento a COVID-19,13.0
"AQUISIÇÃO PELA SECRETARIA MUNICIPAL DE SAÚDE DE INSUMOS MÉDICOS E EQUIPAMENTOS DE PROTEÇÃO INDIVIDUAL, PARA O USO DURANTE A AÇÃO DE PREVE ÇÃO E COMBATE AO CONTÁGIO E PROLIFERAÇÃO DA COVID-19, NO MUNICIPIO DE SÃO BRAZ DO PIAUÍ",13.0
"contratação de empresa especializada no fornecimento de
termômetro, óculos de proteção, proteior facial e ouiros EPls,
dest inados às equipes de enfrentamento do Covid-1 9, no
municioio de Esoerantina-Pl.",13.0
"contratação de empresa para a aqu1s1çao de máscara reutilizável, confeccionada em tecido de algodão lavável, na cor branca e com a logo do Centro de Referência da Assistência Social, no qual garante a cobertura da proteção individual dos servidores que mantém ativa as atividades da secretaria municipal de assistência social, fazendo parte do conjunto de medidas e ações para o combate ao covid-19 no Município de João Costa - PI.",13.0
"PRIMEIRO TERMO ADITIVO AO CONTRATO DE FORNECIMENTO DE MÁSCARA SEMI-FACIAL FILTRANTE (COM FILTRO BACTERICIDA ACIMA DE 95%), PRODUZIDAS DENTRO DAS RECOMENDAÇÕES DA RDC Nº 356, 23103/2020 COM AS NORMAS DO MINISTÉRIO DA SAÚDE/ANVISA E NBR 13698, PARA AUXILIAR NO COMBATE CONTRA A PANDEMIA COVID-19 NO MUNICIPIO DE COCAL-PI.
CONTRATO ORIGINAL O VALOR É DE 13.500,00

Fica prorrogado a partir do dia 29/06/2020 e por mais 60 (sessenta) dias, a saber, até 28/08/2020, o prazo de validade do referido contrat",13.0
Aquisição de Medicamentos,13.0
"Aquisição de EPI'S de proteção individual para os profissionais de saúde no enfretamento do corona vírus (COVID-19), na forma estabelecida pela lei 13.979/2020",13.0
"O presente contrato tem como objeto a aquisicao em carater emergencial de medicamentos para o hospital de campanha N. Sra. De Fatima com a finalidade no tratamento de pacientes infectados pelo COVID- 19 no Municipio de Parnaiba - PI,",13.0
O objeto do presente processo de dispensa é a Aquisição de Equipamentos de Proteção individual para uso no Centro Covid e demais profissionais no combate à Pandemia do carona vírus,13.0
"Aquisição de Equipamento de Proteção lndividual-EPls a serem utilizados pelos trabalhadores do Sistema Único da Assistência Social -SUAS no enfrentamento da pandemia causada pelo COVID-19, visando atender as necessidades desta municipalidade",13.0
Aquisição de Materiais e EPls destinados às ações preventivas e ao enfrentamento e combate da Pandemia do Novo coronavirus (ÇOVID-1 9). através da Secretaria Municipal de Saúde VÁRZEA BRANCA - PI.,13.0
Aquisicão de Materiais e EPls. destinados às ações preventivas e ao enfrentamento e combate da Pandemia do Novo coronavirus COVID-19 através da Secretaria Munici ai de Assistência Social de V RZEA BRANCA - PI.,13.0
"Fomecimentll de equ~tos de EPI, compostll por luvas desc.artáveis, álrool em gel e l(<iJloo, máscaras desca'távels, aventais, propé desca'tável, touca descartável e viseira transparente, destinados aos profissionais da Seaetlia Munk:~I da Assistência Social de Crls1lno Castro-PI. Publicado originalmente em 29/06, pg. 351.",13.0
FORNECIMENTO DE EQUIPAME TOS DE PROTEÇÃO INDNIDUAL DESTINADOS AO ENFRENTAMENTO DA PANDEMIA DA COVID-19 NO ÃMBITO DO MUNICÍPIO DE JOAQUIM PIRES - PL,13.0
FORNEClMENTO DE MATERIAS PARA ENFRENTAMENTO AO COVID- 19 NO MUNICÍPIO OE SÃO JOSÉ DO DIVINO,13.0
AQUISIÇÃO DE MEDICAMENTOS PARA ATENDER AS NECESSIDADES DA SECRETARIA DE SÚDE DO MUNJdPIO DE PADRE MARCOS-PI.,13.0
"
Objeto: Fornecimento de produtos de segurança e de comodidade que possibilitarão aos profissionais da saúde e colaboradores a execução dos serviços de combate à disseminação do coronavírus (SARS-CoV-2), nas barreiras sanitárias com conforto, segurança e eficácia, bem como controlar e exigir que se cumpra, o distanciamento mínimo entre pessoas nas filas enquanto aguardam atendimento nos locais públicos e particulares.",13.0
Aquisição de Medicamentos,13.0
AQUISIÇÃO DE MATERIAL OE PROTEÇAO SECRETARIA MUNICIPAL OE ASSISTÊNC-IA SOCIAL. INDIVIDUAL PARA A,13.0
