text,helpfulness
CONTRATAÇÃO DIRETA DE PESSOA JURIDICA PARA AQUISIÇÃO DE MATERIAL DE LIMPEZA E HIGIENE PARA O ENFRENTAMENTO DA PANDEMIA DO NOVO CORONAVIRUS (COVID-19) NO MUNICIPIO DE BARRO DURO - PI.,9.0
Fornecimento imediato de Material de Limpeza para desinfecção e necessários a manutenção desta Unidade de Saúde para enfrentamento ao COVID-19,9.0
Aquisição de Utensílios de Limpeza,9.0
"Con tratação de empresa para fornecimento de Hipoclorito de Sódio 2% galão ~lts , para atender as necessidades da Secretaria de Saúde do Municipio de Uni ~o-eI",9.0
CONTRATAÇÃO DIRETA DE PESSOA JURIDICA PARA AQUISIÇÃO DE MATERIAL DE LIMPEZA E HIGIENE PARA O ENFRENTAMENTO DA PANDEMIA DO NOVO CORONAVIRUS (COVID-19) NO MUNICIPIO DE BARRO DURO - PI.,9.0
"CONTRATAÇÃO DE EMPRESA ESPECIALIZADA PARA, EM CARÁTER DE URGÊNCIA, AQUISIÇÃO DE MATERIAL DE LIMPEZA COMUM EM RAZÃO DO CRESCIMENTO DA DEMANDA DOS SERVIÇOS INTERNOS DO HOSPITAL INFANTIL LUCÍDIO PORTELA - HILP, JÁ QUE HOUVE O AUMENTO DOS LEITOS DE RETARGUADA NO HOSPITAL INFANTIL LUCÍDIO PORTELA - HILP, COM O OBJETIVO DE DAR ESTRUTURA PARA ATENDER OS PACIENTES ACOMETIDOS PELO COVID-19. Ratificado em 24/02 (pg.17).",9.0
MATERIAL DE LIMPEZA(LOTE 01) e MATERIAL DE LIMPEZA PESADA (LOTE 02) PARA O HOSPITAL ESTADUAL DOMINGOS CHAVES,9.0
"Aquisiçõo de kit higienico (sabõo de coco em bara, detergente lqudo e sabonete em borro), objeiwoodo atender as necessidades desta Secretem Municipal de Saúde do municlpio de Coroúbos do PialA, visto que no momento estamos em sttuoção de emergência de saúde púbíica, em decooência da infecção humana pelo novo coronavirus - COVlD-19 (Republicado em 05/05/2020, à pg. 108)",9.0
AQUISIÇÃO DE MATERIAL DE LIMPEZA PARA O COMBATE AO COVID-19 NO MUNJCIPIO DE LAGOA DO PIAUI-PI,9.0
Material de limpeza,9.0
"Contratação de empresa para aquisição de material de limpeza. e higienização pessoal, no qual garante a manutenção dos prédios da Prefeitura, Secretarias, escolas, Postos de Saúde, entre outros, nas demandas diárias de atendimento assistencial a população Joãocostence.",9.0
"AQUISICAO DE MATERIAL DE LIMPEZA PARA ATENDER AS NECESSIDADES DA ATENCAO BASICA DA SECRETARIA DE SAUDE DO MUNICIPIO DE PARNAIBA — PI, TENDO EM VISTA A NECESSIDADE DE AUMENTAR A HIGIENIZACAO DOS ESPACOS DE SAUDE, PRIMORDIAL PARA A CONTENCAO DA PANDEMIA DE CORONA VIRUS (COVID-19);",9.0
Aquisição de Kits de higiene e limpeza de forma emergencial para combate a pandemia causada pelo COVID-19.,9.0
"Contratação direta para Aquisição de água sanitária destinada à vlgllància sanitária deste Municipio para ser utilizada nas ações de Covid-19, em Uruçul-PI",9.0
"Contratação direta para Aquisição de Agua Sanitária, destinada a Vigilância  Sanitária, deste municipio, para ser utilizada nas ações de combate e prevenção da pandemia do novo coronavírus Covid-19 em Uruçul-PI.",9.0
"OBJETO: CONTRATAÇÃO DE EMPRESA PARA FORNECIMENTO DE MATERIAL DE LIMPEZA (GERAL, LAVANDERIA, MOP, CARRINHO DE LIMPEZA, LIXEIRA) PARA ATENDER AS NECESSIDADES DO HOSPITAL REGIONAL DE CAMPO MAIOR - HRCM",9.0
"CONTRATAÇÃO DE EMPRESA PARA O FORNECIMENTO DE MATERIAIS DE LIMPEZA PARA QUE SEJA FEITA A MANUTENÇÃO EM NOSSAS INSTALAÇÕES COM OBJETIVO DE DIMINUIR OS RISCOS DE CONTAMINAÇÃO E TRANSMISSÃO DO VÍRUS NO AMBIENTE DE TRABALHO ENTRE NOSSOS COLABORADORES QUE ESTÃO ATUANDO NA LINHA DE FRENTE NO COMBATE A PANDEMIA - COVID-19, NO MUNICf PIO DE PEDRO 11/PMPII/PI",9.0
"SERVIÇO DE TRATAMENTO QUÍMICO MENSAL DO SISTEMA AGUAS DE CONSUMO HUMANO, USO DOMESTICO E UTILITÁRIOS DISVERSOS DO HOSPITAL REGIONAL CHAGAS RODRIGUES - HRCR",9.0
"Aquisição de 500 caixas de água sanitária para higieniz.ação e sanitiz.ação da Secretária de Municipal de Saúde, Hospital Municipal e demais Posto de Saúde do Município para combater pandemia do COVIDl 9",9.0
"aquisição MATERIAL DE LIMPEZA - Agua sanitária 1 litro, Detergente líquido 500ml,   para enfrentamento do corona vírus (COVID-19) no município deEsperantina. ",9.0
aquisição MATERIAL DE LIMPEZA - Álcool em gel 500ml  para enfrentamento do corona vírus (COVID-19) no município deEsperantina. ,9.0
"CONTRATAÇÃO DE EMPR.E SA PARA FORNECIME NTO DE MATERIAL DE LIMPEZA E INGIENE PESSOAL PARA DESINFECÇÃO DAS RUAS DA CIDADE, COM FORMA DE PREVENÇÃO E COMBATE AO COVID -1 9 NO MUNICÍPIO D E PATOS DO PIAUI - PI",9.0
"AQUISIÇÃO DE MATERIAL PARA REALIZAR A SANITIZAÇÃO DE ÓRGÃOS E VIAS PÚBLICAS,ATENDENDO DEMANDA DAS AÇÕES DE PREVE ÇÃO E COMBATE AO COVID- 19 NO MU ICIPJO.",9.0
"O objeto do presente proceaso de dispensa é a aquisição de materiais de limpeza diversos para serem utilizados em Barreiras Sanitárias no combate ao coronavlrus, na sede e zona rural do munlclpio de Palmeira do Plaul/PI ",9.0
"Aquisição de material de limpeza de desinfecção no
Combate ao Novo Coronavírus (COVID-19) em virtude da situação de emergência na forma estabelecida pela lei 13.979/2020.",9.0
"MATERIAL DE LIMPEZA HOSPITALAR (Lixeiras e sacos plásticos), RESSALTANDO QUE ESTA AQUISIÇÃO REFERE-SE AO ENFRENTAMENTO DA EMERGÊNCIA DE SAÚDE PÚBLICA DECORRENTE DO CORONAVIRUS.",9.0
"MATERIAL DE LIMPEZA HOSPITALAR (Lixeiras e sacos plásticos), RESSALTANDO QUE ESTA AQUISIÇÃO REFERE-SE AO ENFRENTAMENTO DA EMERGÊNCIA DE SAÚDE PÚBLICA DECORRENTE DO CORONAVIRUS.",9.0
Contratação de empresa especializada no fornecimento de gêneros alimentícios não peredveis e material de limpeza para atender as necessidades do Hospital Municipal Dona Lurdes Mota,9.0
"O objeto do presente processo de dispensa é a aquisição de materiais de limpeza diversos para serem uti lizados no combate ao coronavírus, na sede e zona rural do município de Palmeira do Piauí/PI",9.0
"CONTRATAÇÃO DE EMPRESA PARA FORNECIMENTO DE MATERIAIS DE LIMPEZA, HIGIENE PESSOAL, PARA ATENDER A DEMANDA DA SECRETARIA MUNICIPAL DE SAÚDE DE SÃO JOÃO DA VARJOTA- PI, DURANTE A PANDEMIA DO COVID-19""",9.0
"Fornecimento de Materlais de Limpeza e Hlgiene, destinados ao enfretamento à pandemia do Novo Coronavírus (COVID-19) no do Município de Sõo Gonçalo do Plauf.",9.0
Material de Limpeza,9.0
"Fornecimento de material de higiene, limpeza e sanitização para combate e cnfrentamcnto a Covid-19, cm decorrência da necess idade da Secretaria Municipal de Saúde de São José do Oi vinoPI.",9.0
"Contratação de empresa para aquisição de material de limpeza e h.igieniza.ção pessoal, no qual garante a manutenção dos prédios da Prefeitura, Secretaria Municipal de Assistência Social, Secretaria Municipal de Educação. escolas, fazendo parte do conjunto de medidas e ações para o combate ao COVID- 19, ao funcionamento das atividades no Município de João Costa - PJ.",9.0
"AQUISIÇÃO DE PRODUTOS DE HIGIENE E LIMPEZA PARA
ATENDIMENTO ÀS MEDIDAS DE ENFRENTAMENTO A PANDEMIA
DO CORONAVIRUS-COVID-19.",9.0
ulsi~o de Produtos de LIMPEZA e Higienizantes destinados a uso das equipes de Trabalho e distribuição a famílias carentes do município de Dirceu An:overde-PI,9.0
"MATERIAL DE LIMPEZA HOSPITALAR (Lixeiras e sacos plásticos), RESSALTANDO QUE ESTA AQUISIÇÃO REFERE-SE AO ENFRENTAMENTO DA EMERGÊNCIA DE SAÚDE PÚBLICA DECORRENTE DO CORONAVIRUS.",9.0
MATERIAL DE SANITIZAÇÃO,9.0
"PRESENTE TERMO ADITNO TEM COMO OBJETNO A INCLUSÃO DE NOVO PROJETO/ATIVIDADE NO CONTRATO PRIMITIVO, TENDO POR OBJETO A ""AQUISIÇÃO DE MATERIAL DE HIGIENE E LIMPEZA E MATERIAL DESCARTAVEL EM GERAL, PARA A PREFEITURA MUNICIPAL E SUAS SECRETARIAS DO MUNICIPIO DE SANTANA DO PIAUI - PI'.",9.0
PRORROGAÇÃO MATERIAL DE LIMPEZA(LOTE 01) e MATERIAL DE LIMPEZA PESADA (LOTE 02) PARA O HOSPITAL ESTADUAL DOMINGOS CHAVES,9.0
Aquisição de Acessório de Limpeza,9.0
Aquisição de Materiais de Limpeza,9.0
"Aquisição de Malcriais de limpeza hospitalar visando o cnfrcntarncnto da pandemia do novo corona vlrus (eovid - l 9)para ,11c11Clcr as ncocssidndcs do Munielpio de Nossa Scnl,ora de N,mué-PI",9.0
Aquisição de material de limpeza,9.0
Contratação de empres jurídica na produtos de limpeza para este hospital,9.0
Aquisição de material de limpeza,9.0
Contratação de Empresa para Fornecimento de Materiais para Desinfecção no Combate e Prevenção ao Coronavinis para a Secretaria de Saúde do Município de Porto Alegre do Piauí - PT.,9.0
CONTRATAÇÃO DE EMPRESA PARA O FORNECIMENrO DE MATERIAL DE LIMPEZA PARA ATENDER AS NECESSIDADES DO .FUNDO MUNICIPAL DE ASSISTENCIA SOCIAL DO MUNICIPIO DE BOA HORA-PIAUI EM DECORIIBNCIA DA PANDEMIA DO COVID-19,9.0
Aquisição de Material de Limpeza,9.0
Aquisição de material de limpeza para atender as necessidades do Hospital João Luiz de Morais,9.0
Aquisição emergencial de materiais de limpeza e higiene.,9.0
Aquisição de Material de limpeza,9.0
"O objeto do presente contrato consiste na Contratação de empresa para fornecimento parcelado de materiais de higiene e limpeza e material de consumo para atender as necessidades da Secretaria Municipal de Saúde de Santa Filomena - PI, para situação emergencial em Decorrência da Pandemia do COVID-19.",9.0
"Apostila-se a dáusula quartaanterionnente e acordadano Contrato n"" 069/2018, para que seja induso a Fontede Recurso: 214 - Projeto Atividade 2159pennanecendo válidas e inalteradas as demais, não expressamente modificadas por este Instrumento.",9.0
Contratação de empresa para fornecimento de material de limpeza atender as necessidades do Hospital Estadual Teresinha Nunes de Barros.,9.0
AQUISICAO DE MATERIAL DE LIMPEZA PARA ATENDER AS NECESSIDADES DO HOSPITAL DE CAMPANHA NOSSA SENHORA DE FATIMA DA SECRETARIA DE SAUDE DO DE PARNAIBA-PI.,9.0
AQUISICAO DE MATERIAL DE LIMPEZA PARA ATENDER AS NECESSIDADES DO HOSPITAL DE CAMPANHA NOSSA SENHORA DE FATIMA DA SECRETARIA DE SAUDE DO MUNICIPIO DE PARNAIBA-PI. PARA O PERIODO DE AGOSTO E SETEMBRO DE 2020),9.0
"Contratação de empresa especializada no fornecimento de materiais de consumo a serem utilizados por diversos órgãos da Prefeitura de Teresina em virtude da pandemia do covid-19, tudo conforme especificações:  LOTE: 2. ESPECIFICAÇÃO: Água sanitária – solução aquosa, princípio ativo: hipoclorito de sódio, plástica contendo 1.000ml, produto com registro no Ministério da Saúde, hipoclorito de sódio, hidróxido de sódio, hidróxido de sódio e água teor ativo entre 2% e 2,5% p/p.",9.0
Aquisição de Material de Limpeza,9.0
Água sanitária.,9.0
Detergente líquido.,9.0
"Contratação de empresa especializada no fornecimento de materiais de consumo a serem utilizados por diversos órgãos da Prefeitura de Teresina em virtude da pandemia do covid-19, tudo conforme especificações: LOTE: 6. ESPECIFICAÇÃO: detergente líquido, perfumado, com PH neutro, para uso em saboneteira, diluição, pronto pra uso. UNID.: caixa com 100 unidades. QUANT.: 1.000.",9.0
"Fornecimento de materiais de consumo a serem utilizados pela Superintendência de Desenvolvimento Urbano Centro/Norte - Sdu Centro/Norte, em virtude da pandemia do Covid-19, de acordo com a Ata de Registro de Preços nº004/2020 - SEMA. Conforme especificações: Lote: 02; Unidade de Medida: LITRO; Quantidade: 6.500; Especificação: Água Sanitária – Solução Aquosa, princípio ativo: hipoclorito de sódio, plástica contendo 1.000ml, produto com registro no Ministério da Saúde, hipoclorito de sódio, hidróxido de sódio e água, teor ativo entre 2% e 2,5% p/p.",9.0
"Contratação de empresa especializada no Fornecimento de materiais de consumo a serem utilizados pela Superintendência de Desenvolvimento Urbano Centro/Norte - Sdu Centro/Norte,
em virtude da pandemia do Covid-19, de acordo com a Ata de Registro de Preços nº004/2020 - SEMA. Conforme especificações: Lote: 06; Unidade de Medida: Frasco de 500ML; Quantidade: 4.000; Especificação: Detergente líquido, perfumado, com PH neutro, para uso em saboneteira, diluição: pronto para uso",9.0
LOCAÇÃO DE 15 (QUINZE) VENTILADORES MECÂNICOS E 20 ( VINTE) MONITORES MULTIPARAMÉTRICOS,10.0
"CONTRATAÇÃO DE EMPRESA ESPECIALIZADA EM CARÁTER DE URGÊNCIA, PARA LOCAÇÃO DE EQUIPAMENTOS - RAIO - X MÓVEL, ULTRASSOM MÓVEL E SISTEMA CR DE DIGITALIZAÇÃO DE IMAGENS RADIOGRÁFICAS, EQUIPAMENTO DE ECOCARDIOGRAMA E RADIOLOGIA DE ALTA DEFINIÇÃO - PARA USO EXCLUSIVO DE PACIENTES INFECTADOS PELO VIRUS COVID-19, PELO PERÍODO DE TRÊS MESES, VISANDO COMPOR A MONTAGEM DE LEITOS DE RETARGUADA NO HOSPITAL INFANTIL LUCÍDIO PORTELA - HILP, PARA PREPARAR O HOSPITAL, BEM COMO DAR ESTRUTURA PARA ATENDER OS PACIENTES INFECTADOS PELO COVID-19 (NOVO CORONAVÍRUS)",10.0
CONTRATAÇÃO DE EMPRESA ESPECIALIZADA NA PRESTAÇÃO DE SERVIÇO DE LOCAÇÃO DE 10 (DEZ) AMBULÂNCIAS TIPO B e D PARATRANSPORTE DE PACIENTES INFECTADOS PELO NOVO CORONAVÍRUS PARA OS HOSPITAIS INTERESTADUAIS,10.0
" CONTRATAÇAO DE EMPRESA PARA PRESTAÇÃO DE SERVIÇO DE LOCAÇÃO DE EQUIPAMENTOS AO INSTITUTO DE DOENÇAS TROPICAIS NATAN PORTELA, para atender as necessidades no combate a epidemia de Covid-19",10.0
"CONTRATAÇÃO DE SERVIÇO DE LOCAÇÃO DE TENDA
EM CARÁTER EMERGENCIAL, PELO PERÍODO DE 60 (sessenta) DIAS, PARA ATENDER AS NECESSIDADES DA MATERNIDADE DONA EVANGELINA ROSA - MDER, DURANTE O PERÍODO DE COMBATE A PANDEMIA DO CORONAVIRÚS. (CONSULTÓRIO DE TRIAGEM EMERGENCIAL)",10.0
"CONTRATAÇÃO DE EMPRESA PARA LOCAÇÃO DE 01 (UM) VEÍCULO TIPO CAMINHONETE, CABINE DUPLA, COM AR CONDICIONADO, DIREÇÃO HIDRÁULICA, VIDROS E TRAVAS ELÉTRICOS, ALARME, E DEMAIS ITENS DE SEGURANÇA OBRIGATÓRIOS, EM ÓTIMO ESTADO DE CONSERVAÇÃO E PERFEITAS CONDIÇÕES DE USO, COM MANUTENÇÃO E COMBUSTÍVEL POR CONTA DO CONTRATANTE, PARA ATENDER ÀS NECESSIDADES DO MUNICÍPIO DE BARRA D'ALCÂNTARA/PI, NAS AÇÕES DE COMBATE AO CORONAVÍRUS (COVID-19), CONFORME ESPECIFICAÇÕES E QUANTITATIVOS EM ANEXO",10.0
"Contratação de locação de veiculo tipo caminhonete /AB/CAB.DUPLA, GM/S10 ,2009/2010, 05, para uso das Equipes de Saúde e Vigilância Sanitária no combate a carona vírus e rastreamento de casos suspeitos, na sede e zona rural do município de Palmeira do Piaui/PI",10.0
"LOCAÇÃO DE TENDAS, destinadas aos usuários da lotérica em apoio as atividades de distanciamento social em Controle ao COVID -19 com lotação no Fundo Municipal de Saúde deste Município.",10.0
LOCAÇÃO DE AMBULANCIA SEM CONDUTOR.,10.0
LOCAÇÃO DE STANDS COMO INFRAESTRUTURA FÍSICA DOS HOSPITAIS DE CAMPANHA PE. PEDRO BALZI E LAR DA FRATERNIDADE,10.0
"LOCAÇÃO DE VEÍCULOS DE FORMA EMERGENCIAL PARA ATENDER AS
NECESSIDADES DA SECRETARIA DE OBRAS DO MUNICÍPIO DE BRASILEIRA-PI (vigência alterada de 4 para 2 meses no DOM de 30/04/2020).",10.0
"LOCAÇÃO DE VEÍCULOS DE FORMA EMERGENCIAL PARA ATENDER AS
NECESSIDADES DA SECRETARIA DE ASSISTÊNCIA SOCIAL DO MUNICÍPIO DE BRASILEIRA-PI (vigência alterada de 4 para 2 meses no DOM de 30/04/2020).",10.0
"LOCAÇÃO DE VEÍCULOS DE FORMA EMERGENCIAL PARA ATENDER AS
NECESSIDADES DA SECRETARIA DE SAÚDE DO MUNICÍPIO DE BRASILEIRA-PI (vigência alterada de 4 para 2 meses no DOM de 30/04/2020).",10.0
"LOCAÇÃO DE VEÍCULOS DE FORMA EMERGENCIAL PARA ATENDER AS
NECESSIDADES DA SECRETARIA DE SAÚDE DO MUNICÍPIO DE BRASILEIRA-PI (vigência alterada de 4 para 2 meses no DOM de 30/04/2020).",10.0
"LOCAÇÃO DE VEÍCULOS DE FORMA EMERGENCIAL PARA ATENDER AS
NECESSIDADES DA SECRETARIA DE ASSISTÊNCIA SOCIAL DO MUNICÍPIO DE BRASILEIRA-PI (vigência alterada de 4 para 2 meses no DOM de 30/04/2020).",10.0
LOCAÇÃO DE DUAS TENDAS PARA ABRIGAR OS EQUIPAMENTOS E SERVIDORES QUE TRABALHARAM NAS BARREIRAS SANITÁRIAS PROVIDAS PELA SECRETARIA MUNICIPAL DE SAÚDE PARA COMBATE A PROPAGAÇÃO DO CORONA VlRUS,10.0
"LOCAÇÃO DE 02 (DUAS) MÁQUINAS DE OSMOSE REVERSA PORTÁTIL, COM MANUTENÇÃO PREVENTIVA E CORRETIVA, PELO PERÍODO DE 06 (SEIS) MESES, PARA ATENDER AS NECESSIDADES DO HOSPITALGETÚLIOVARGAS - HGV",10.0
"Aditivo à Dispensa nº 001/2020 (mudança de fonte para COVID), que tem como objeto a Contratação dos serviços de Locação de som, palco, gerador, grid, banheiro químico e tendas, para realização de shows artísticos em praça pública, nas datas de 24 a 26/01/2020, por ocasião da Comemoração do 26° Aniversário de Emancipação Política do Município de Barra D'Alcântara/PI",10.0
LOCAÇÃO DE VEÍC LOS DESTI ADOS AS SECRETARIAS DE SAÚDE E A SI TENCIA OCIAL PARA ATENDER O MU ICÍPIO O COMBATE AO COVID-19,10.0
"PRESTAÇÃO DE SERVIÇOS DE WCAÇÃO DE 02(DOIS) veículos COM MOTORISTA, EM CARÁTER DE URGÉNCIA E EMERGÊNCIA, A FIM TRANSPORTAR AS EQUIPES DE SAÚDE DA FAMU,IA(ESF), COM O FITO DE ESTABELECEREM MEDIDAS PARA ENFRENTAMENTO DA EMERGÉNCIA DE
SAÚDE PÚBLICA DE IMPORTÃNCIA INTERNACIONAL DECORRENTE DO NOVO CORONAVÍRUS, NOS TERMOS DECIARADOS PEIA ORGANIZAÇÃO
MUNDIAL DE SAÚDE (OMS) E AS RECOMENDAÇÕES EXPEDIDAS PELO MINISTÉRIO DA SAÚDE, NO MUNICÍPIO DE CURIMATÃ-PI.",10.0
"PRESTAÇÃO DE SERVIÇOS DE LOCAÇÃO, TRANSPORTE, MONTAGEM E DESMONTAGEM DE ESTRUTURAS, TOLDOS, MOBILIÁRIOS PARA ESTANDES E BANHEIROS QUÍMICOS, PARA A ESTRUTURAR IMÓVEIS EXISTENTES PARA O DESENVOLVIMENTO DE ATIVIDADES ASSISTENCIAIS DE SAÚDE DE INTERNAÇÃO E TRATAMENTO DO COVID-19, EM HOSPITAIS DE CAMPANHA NA CIDADE DE TERESINA",10.0
"Contratação de empresa para locação de tendas e grades disciplinadoras para utilização em frente a agencia bancaria da Caixa Econômica do Município de Água Branca no enfrentamento da COVID-19, pelo um período de 30 (trinta) dias",10.0
Contratação de tendas e demais estruturas para seram utilizados nas ações de combate e enfrentamento ao COVID-19,10.0
"Locação de banheiros quimicos, para serem utilizados nas ações de combate e enfrentamento ao COVID-19",10.0
"Contratação de empresa especializada na prestação de serviços de locação de tendas para medidas de prevenção ao Covid19, a serem instaladas em frente ao IFPI/POSTO PAIZÃO e CODIP, no Munlciplo de Uruçuí-PI",10.0
"Locação de 02(duos) !ondas de 12m x 8m e 80[oltentoJ cadetes de p!éstico pera serem iratolodos no Avenida F-einlo Tomaz Portelo, próximo ô Co50 Lolooco pal'CI melhorar o dlstonciomenlo social e o controle de pessoas no prevênçao e combate ao COVID-19, visto que no momento eslomos em sltuaçõo de emergência de Saúde pública, em decorrência do lnlecçôo humano pelo novo oorono vius - !COVID-19)",10.0
"LOCAÇÃO DE EQUIPAMENTOS DE RAIO X DIGITAL MÓVEL, APARELHO DE ULTRASSONOGRAFIA, EQUIPAMENTO DE TOMOGRAFIA COMPUTADORIZADA E SISTEMA PORTÁTIL COM NOTEBOOK PARAAQUISIÇÃO DE IMAGENS DIGITAIS - DR, PARA SUPORTE DE DIAGNÓSTICO POR IMAGEM NA MATERNIDADE DONA EVANGELINA ROSA - MDER PARA ATENDER DEMANDA DE PACIENTES DA PANDEMIA DA COVID19, RESSALTANDO QUE ESTA AQUISIÇÃO REFERE-SE AO ENFRENTAMENTO DA EMERGÊNCIA DE SAÚDE PÚBLICA DECORRENTE DO CORONAVIRUS. Ratificada em 28/04 (pg. 027), extrato publicado originalmente em 07/05 (pg. 29), retificado no dia 12/05/2020.",10.0
"Constitui objeto do presente Termo de Contrato de fornecimento tendas -serviços de montagens, manutenção desmontagem de tenda medindo Smx Sm, com cobertura em lona night day, cor branca, com estrutura em ferro galvanizado e altura do pé direito de 2,Sm, modelo piramide,, conforme especificações e quantitativos no termo de referência e proposta por necessidade de excepcional interesse público, para o enfrentamento emergencial do novo coronavírus {COVID",10.0
Contratação empresa para locação de Tendas para os profissionais da saúde que estão trabalhando nas barreiras no combate e prevenção de c11íre nwmcnto da p;11ldcmfa do 110vo coronavin1s (covid-1 9) do município de Nan1ré do Piau í.,10.0
"Aquisição de contratação  de serviços de locação  de tendas, grades e .banheiros químicos :para apoio à população usuária de bancos; casas· lotéricas e estabelecimentos congêneres,:em ação, para 'O combate à pandemia· da COVID_19,no periodo inicial de 30 diaS",10.0
"(ERRATA) CONTRATAÇÃO DE EMPRESA PARA FORNECER POR MEIO DE LOCAÇÃO TENDAS COM FECHAMENTOS PARA COLOCAÇÃO NAS RUAS
E AV. EM LOCAIS ESTRATÉGICOS DA SEDE DO MUNICf PIO PARA PROTEGER DO SOL E AJUDAR NO CONTROLE DE DISTANCIAMENTO PESSOAS, PROTEÇÃO DAS EQUIPES DE APOIO DA SA0DE E POLICIAMENTO DAS VIAS E LOCAIS DE BARREIRA DE FISCALIZAÇÃO, MEDIDA DE PROTEÇÃO E PREVENÇÃO CONTRA O COVID-19. Publicação original em 06/05, pg. 153.",10.0
"locação de estrutura para organl:z:ação de barricadas, filas e barreira sanitária para o combate ao covld·19 no Municlpio de Pio IX/PI.",10.0
"Serviços de locação de tendas, cobertura de alumínio e grades disciplinadora para instalação em frente a Casa Lotérica do Município de Angical do Piauí - PI, como medida de contenção, afim de evitar a disseminação do novo Corona Vírus (COVID",10.0
contratação de empresa especializada no ramo de locação de estruturas metálica (Tendas e Barricadas) para auxiliar no combate ao COVID-19 em caráter emergencial,10.0
"Contrataçao de empresa especializada na prestaçao de serviços de locação de banheiros quimicos, tendas de estruturas metálicas, cadeiras plásticas e água mineral, para serem utilizadas em áreas públicas, tais como: praças, bancos, calçadas, barreiras, em virtude da necessidade de minimizar os riscos de contaminação pelo COVID-19 (Carona Vírus), no municlpio de pimenteiras - P",10.0
"CONTRATAÇÃO DE SERVIÇO DE LOCAÇÃO DE DOIS APARELHOS ANALISADORES DE GASOMETRIA COM FORNECIMENTO DE INSUMOS/PACK, PELO PERÍODO DE 180 (CENTO E OITENTA) DIAS PARA ATENDER AS NECESSIDADES DO HOSPITAL GETÚLIO VARGAS - HGV",10.0
CONTRATAÇÃO DE EMPRESA PARA LOCAÇÃO DE TENDAS E BANHEIROS QUÍMICOS PARA AUXILIAR AS BARREIRAS SANITARIAS NO COMBATE AO COVID-19 NO MUNICIPIO DE PEDRO LAURENTINO(PD,10.0
"CONTRATAÇÃO DE EMPRESA PARA CONFECÇÃO DE TENDAS COM COBERTURAS EM LONA IMPERMEÁVEL E ESTRUTURA RIGIDA, MEDINDO 5X5 m, PARA O APOIO AO COMBATE DO COVID-19, NO MUNICÍPIO DE CARIDADE DO PIAUÍPI",10.0
CONTRATAÇÃO DE EMPRESA PARA ALUGUEL DE TENDA GALPÃO PARA ATENDER AS NECE5.5UDADES 00 MUNICÍPIO DE LAGOA 00 PIAUÍ-PI,10.0
"Contratação de empresa, para locação de Banheiro Qulmico versão Standard (largura 1,10m, comprimento 1,20m, altura mínima de 2,10m) com manutenção) e Tendas (com montagem, desmontagem e manutenção, em lona branca no estilo piramidal com base em estrutura metãlica, medindo 6.00m x 6,00m cada, altura de 3,00m em seus pés de sustentação), a serem disponibilizados nas Barreiras de monitoramento na entrada/saída de pessoas na cidade de João Costa - PI, fazendo parte do conjunto de medidas e ações para o combate ao COVID-19",10.0
"Fornecimento de tendas piramidais com estrutura em aço carbono industrial, para atender as necessidades do município de Al tos",10.0
CONTRATAÇÃO DE EMPRESA PARA LOCAÇÃO DE TENDAS E GRADES DE PROTEÇÃO PARA UTILIZAÇÃO NO COMBATE A COVID19 NO MUNICIPIO DE REGENERAÇÃO - PI,10.0
"LOCAÇÃO DE TENDAS MEDINDO 5X5, COM COBERTURA DE LOCA ""NIGHT DAY"", NA COR BRANCA CONFECCIONADA EM ESTRUTURA METALICA EM FERRO GALVANIZADO, COM ALTURA DE PÉ DIREITO DE 2,5 METRO, MODELO PIRAMIDE, PARA UTILIZAR NAS ""BARREIRAS SANITÁRIAS"", INSTALADAS NAS ENTRADAS DA CIDADE, CONFORME DISPENSA 08/2020",10.0
LOCAÇÃO DE 03 (TR!S TENDAS PARA ATENDER DEMANDA DAS AÇÕES DE PREVENÇÃO E COMBATE AO COYID-19 NO MUNICIPlo,10.0
"LOCAÇÃO DE UM VEICULO PARA TRAll'SPORTE DE
ANIMAIS CAPTORAD0S EM SITUAÇÃO DE ABANDONO NAS VIAS P011LICAS, VISANDO EVITAR
llfFESTAÇÕES DE PULGAS, CARRAPATOS, CAI.AZAR, RAIVA E OUTROS DANOS A POPULAÇÃO ESPECIFICAÇÕES DESCRITAS NO ANEXO 1, PARTE llfTEQRAJITE E DE ACORDO COII A LEl Nº
8.666/1993, TAIIBb REGULADA PELA LEI N"" 13.979/ll!nO CONFORll:E ESPEC1FICAÇÕES DESCRITAS RECOIIE1'DAÇÃO CONJUNTA IIPT/IIPE 11• O1/ll!nO, ",10.0
Prestação de serviços para locação de 03 (três) tendas 5 x 5 com cobertura em lona impermeável e estrutura para o enfrentamento do covid-1 9 no Municlpio de Jacobina do Piauí-P,10.0
LOCAÇÃO DE 06 (SE IS) TENDAS PARA ATENDER DEMANDA DAS AÇÕES DE PREVE ÇÃO E COMBATE AO COVID- 19 NO MU ICIPIO.,10.0
CONTRATAÇÃO DE EMPRESA PARA LOCAÇÃO DE TENDAS PARA O CO 4BATE COVID-19 O MU lCÍPIO DE DO INOCÊNCIO - PI,10.0
 locação de toldos padronizados para a utilização em espaços públicos para adequação de medidas preventivas contra a Pandemia de do Covid-19,10.0
CONTRATAÇÃO DE EMPRESA PARA PRESTAÇÃO DE SERVIÇOS ALUGUEL DE l(UM) VEÍCULO COM MOTORISTA PARA ATUÀ.R'NO AUXILIO DE PREVENÇÃO E COMBATE AO CORONA vfRus NO MUNICÍPIO DE SÃO BRAZ DO PIAUÍ-PI,10.0
ontratação de empresa para locação de tendas para o enfrentamento do covid19 no Município de Paulistana-PI. ,10.0
" LOCAÇÃO DE ESTRUTURA (TENDAS, DISCIPLINADOR E SOM VOLANTE)",10.0
CO TRATAÇÃO DE EMPRESA DO RAMO PERTINE TE PARA PRESTAÇÃO DE SERVIÇOS DE LOCAÇÃO DE TENDAS EM MISSÃO DO COMBATE AO COVID-19 O MUNICIPIO DE BOA HORA-PI,10.0
"LOCAÇÃO DE UM VEICULA PARA APOIO. TRANSPORTE, E MONT AOEM OE BARRACAS DAS BARREIRAS SANITÁRIAS NO ENFRENTAMENTO AO tOVl0-19",10.0
"Prestação de serviço de locação de dois veículos para o para Secretaria Municipal de Saúde para o enfrentamento da emeigência de saúde pública, causada pelo Corooavírus (C.Ovid-19), no Município de Arraial- PI",10.0
"Locoçõo de 02(duosl tendas de 12m x &n e 80(oitento) coderos de plástico poro serem i1stolodos no Avenida Felnlo Tomoz Portelo. prôxmo à Coso lolerico poro melhorar o d~tonciamento social e o controle de pessoas no prevênçõo e combate oo COVID-19, ~o que no momento estamos em situação de emergência de saúde público. em decorrência do nfecçõo humano pelo novo corono vírus - (COVID-19).",10.0
CONTRATO DE AQUISIÇÃO DE TUNEL INFLAVEL COM NEBULIZAÇÃO,10.0
CONTRATO DE EMPRESA ESPECIALIZADA EM LOCAÇÃO DE AMBULÂNCIA,10.0
